{
  "schema_version": "performance-environment/v1",
  "profile_id": "p4-bmv2-wsl2-functional/v1",
  "claim_scope": "software-functional-reference",
  "host": {
    "architecture": "x86_64",
    "cpu_model": "13th Gen Intel(R) Core(TM) i9-13980HX",
    "logical_cpus": 8,
    "physical_cores_exposed": 4,
    "numa_nodes": 1,
    "memory_bytes": 16565002240,
    "hypervisor": "Microsoft WSL2",
    "kernel": "6.18.33.2-microsoft-standard-WSL2",
    "operating_system": "Ubuntu 22.04.5 LTS",
    "microcode": "0xffffffff",
    "cpufreq_governor": "unavailable"
  },
  "container_runtime": {
    "docker_engine": "29.5.0",
    "docker_api": "1.54",
    "compose": "5.1.3",
    "cgroup_version": 2,
    "cgroup_driver": "systemd",
    "storage_driver": "overlayfs"
  },
  "resource_partitions": {
    "switch": {"cpuset": "0-3", "memory_bytes": 2147483648, "pids": 256},
    "runner": {"cpuset": "4-7", "memory_bytes": 4294967296, "pids": 512}
  },
  "qualification_limits": {
    "not_hardware": true,
    "not_line_rate": true,
    "not_native_linux": true,
    "not_production_ha": true
  }
}
